<?xml version="1.0" standalone="no"?>

<!DOCTYPE caldavtest SYSTEM "caldavtest.dtd">

<!--
 Copyright (c) 2006-2007 Apple Inc. All rights reserved.

 Licensed under the Apache License, Version 2.0 (the "License");
 you may not use this file except in compliance with the License.
 You may obtain a copy of the License at

  http://www.apache.org/licenses/LICENSE-2.0

 Unless required by applicable law or agreed to in writing, software
 distributed under the License is distributed on an "AS IS" BASIS,
 WITHOUT WARRANTIES OR CONDITIONS OF ANY KIND, either express or implied.
 See the License for the specific language governing permissions and
 limitations under the License.
 -->

<caldavtest>
	<description>Test expand-property REPORT</description>

	<start/>
	
	<test-suite name='Basic REPORT' ignore='no'>
		<test name='1'>
			<description>OK property query</description>
			<request print-response="no">
				<method>REPORT</method>
				<ruri>$principal1:</ruri>
				<data>
					<content-type>text/xml; charset=utf-8</content-type>
					<filepath>Resource/expandproperty/1.xml</filepath>
				</data>
				<verify>
					<callback>multistatusItems</callback>
					<arg>
						<name>prefix</name>
						<value>-</value>
					</arg>
					<arg>
						<name>okhrefs</name>
						<value>$principal1:</value>
					</arg>
				</verify>
			</request>
		</test>
		<test name='2'>
			<description>Missing property query</description>
			<request print-response="no">
				<method>REPORT</method>
				<ruri>$principal1:</ruri>
				<data>
					<content-type>text/xml; charset=utf-8</content-type>
					<filepath>Resource/expandproperty/2.xml</filepath>
				</data>
				<verify>
					<callback>propfindItems</callback>
					<arg>
						<name>badprops</name>
						<value>DAV:missing</value>
					</arg>
				</verify>
			</request>
		</test>
		<test name='3'>
			<description>Two OK properties (one empty) query</description>
			<request print-response="no">
				<method>REPORT</method>
				<ruri>$principal1:</ruri>
				<data>
					<content-type>text/xml; charset=utf-8</content-type>
					<filepath>Resource/expandproperty/3.xml</filepath>
				</data>
				<verify>
					<callback>multistatusItems</callback>
					<arg>
						<name>okhrefs</name>
						<value></value>
					</arg>
				</verify>
			</request>
		</test>
	</test-suite>
	
	<test-suite name='Access Control' ignore='no'>
		<test name='1'>
			<description>Set property to point to someone else's calendar</description>
			<request print-response="no">
				<method>PROPPATCH</method>
				<ruri>$pathprefix1:/</ruri>
				<data>
					<content-type>text/xml; charset=utf-8</content-type>
					<filepath>Resource/expandproperty/4.xml</filepath>
				</data>
				<verify>
					<callback>statusCode</callback>
				</verify>
			</request>
		</test>
		<test name='2'>
			<description>Try query against accessible href</description>
			<request print-response="no">
				<method>REPORT</method>
				<ruri>$pathprefix1:/</ruri>
				<data>
					<content-type>text/xml; charset=utf-8</content-type>
					<filepath>Resource/expandproperty/5.xml</filepath>
				</data>
				<verify>
					<callback>multistatusItems</callback>
					<arg>
						<name>prefix</name>
						<value>-</value>
					</arg>
					<arg>
						<name>okhrefs</name>
						<value>$pathprefix1:/</value>
					</arg>
				</verify>
				<verify>
					<callback>dataString</callback>
					<arg>
						<name>contains</name>
						<value>displayname</value>
					</arg>
				</verify>
			</request>
		</test>
		<test name='3'>
			<description>Try query against inaccessible href</description>
			<request print-response="no">
				<method>REPORT</method>
				<ruri>$pathprefix1:/</ruri>
				<data>
					<content-type>text/xml; charset=utf-8</content-type>
					<filepath>Resource/expandproperty/6.xml</filepath>
				</data>
				<verify>
					<callback>multistatusItems</callback>
					<arg>
						<name>prefix</name>
						<value>-</value>
					</arg>
					<arg>
						<name>okhrefs</name>
						<value>$pathprefix1:/</value>
					</arg>
				</verify>
				<verify>
					<callback>dataString</callback>
					<arg>
						<name>notcontains</name>
						<value>displayname</value>
					</arg>
				</verify>
			</request>
		</test>
		<test name='4'>
			<description>Reset property</description>
			<request print-response="no">
				<method>PROPPATCH</method>
				<ruri>$pathprefix1:/</ruri>
				<data>
					<content-type>text/xml; charset=utf-8</content-type>
					<filepath>Resource/expandproperty/7.xml</filepath>
				</data>
				<verify>
					<callback>statusCode</callback>
				</verify>
			</request>
		</test>
	</test-suite>
	
	<test-suite name='Invalid REPORTs' ignore='no'>
		<test name='1'>
			<description>Wrong Depth 1</description>
			<request print-response="no">
				<method>REPORT</method>
				<header>
					<name>Depth</name>
					<value>1</value>
				</header>
				<ruri>$principal1:</ruri>
				<data>
					<content-type>text/xml; charset=utf-8</content-type>
					<filepath>Resource/expandproperty/1.xml</filepath>
				</data>
				<verify>
					<callback>statusCode</callback>
					<arg>
						<name>status</name>
						<value>400</value>
					</arg>
				</verify>
			</request>
		</test>
		<test name='2'>
			<description>Wrong Depth infinity</description>
			<request print-response="no">
				<method>REPORT</method>
				<header>
					<name>Depth</name>
					<value>infinity</value>
				</header>
				<ruri>$principal1:</ruri>
				<data>
					<content-type>text/xml; charset=utf-8</content-type>
					<filepath>Resource/expandproperty/1.xml</filepath>
				</data>
				<verify>
					<callback>statusCode</callback>
					<arg>
						<name>status</name>
						<value>400</value>
					</arg>
				</verify>
			</request>
		</test>
		<test name='3'>
			<description>Multi-expand not supported</description>
			<request print-response="no">
				<method>REPORT</method>
				<ruri>$principal1:</ruri>
				<data>
					<content-type>text/xml; charset=utf-8</content-type>
					<filepath>Resource/expandproperty/8.xml</filepath>
				</data>
				<verify>
					<callback>statusCode</callback>
					<arg>
						<name>status</name>
						<value>501</value>
					</arg>
				</verify>
			</request>
		</test>
	</test-suite>
	
	<test-suite name='Membership REPORT' ignore='no'>
		<test name='1'>
			<description>Non-expanding group-member-set query</description>
			<request print-response="no">
				<method>REPORT</method>
				<ruri>$uids:toplevelgroup/</ruri>
				<data>
					<content-type>text/xml; charset=utf-8</content-type>
					<filepath>Resource/expandproperty/9.xml</filepath>
				</data>
				<verify>
					<callback>multistatusItems</callback>
					<arg>
						<name>prefix</name>
						<value>-</value>
					</arg>
					<arg>
						<name>okhrefs</name>
						<value>$uids:toplevelgroup/</value>
					</arg>
				</verify>
				<verify>
					<callback>dataString</callback>
					<arg>
						<name>contains</name>
						<value>User 14</value>
					</arg>
				</verify>
				<verify>
					<callback>dataString</callback>
					<arg>
						<name>contains</name>
						<value>Sub Group 1</value>
					</arg>
				</verify>
				<verify>
					<callback>dataString</callback>
					<arg>
						<name>contains</name>
						<value>Sub Group 2</value>
					</arg>
				</verify>
				<verify>
					<callback>dataString</callback>
					<arg>
						<name>notcontains</name>
						<value>User 10</value>
					</arg>
				</verify>
			</request>
		</test>
		<test name='2'>
			<description>Expanding group-member-set query</description>
			<request print-response="no">
				<method>REPORT</method>
				<ruri>$uids:toplevelgroup/</ruri>
				<data>
					<content-type>text/xml; charset=utf-8</content-type>
					<filepath>Resource/expandproperty/10.xml</filepath>
				</data>
				<verify>
					<callback>multistatusItems</callback>
					<arg>
						<name>prefix</name>
						<value>-</value>
					</arg>
					<arg>
						<name>okhrefs</name>
						<value>$uids:toplevelgroup/</value>
					</arg>
				</verify>
				<verify>
					<callback>dataString</callback>
					<arg>
						<name>contains</name>
						<value>User 10</value>
					</arg>
				</verify>
				<verify>
					<callback>dataString</callback>
					<arg>
						<name>contains</name>
						<value>User 11</value>
					</arg>
				</verify>
				<verify>
					<callback>dataString</callback>
					<arg>
						<name>contains</name>
						<value>User 12</value>
					</arg>
				</verify>
				<verify>
					<callback>dataString</callback>
					<arg>
						<name>contains</name>
						<value>User 13</value>
					</arg>
				</verify>
				<verify>
					<callback>dataString</callback>
					<arg>
						<name>contains</name>
						<value>User 14</value>
					</arg>
				</verify>
				<verify>
					<callback>dataString</callback>
					<arg>
						<name>contains</name>
						<value>Sub Group 1</value>
					</arg>
				</verify>
				<verify>
					<callback>dataString</callback>
					<arg>
						<name>contains</name>
						<value>Sub Group 2</value>
					</arg>
				</verify>
				<verify>
					<callback>dataString</callback>
					<arg>
						<name>contains</name>
						<value>User 10</value>
					</arg>
				</verify>
			</request>
		</test>
	</test-suite>
	
	<end/>

</caldavtest>
