<?xml version="1.0" standalone="no"?>

<!DOCTYPE caldavtest SYSTEM "caldavtest.dtd">

<!--
 Copyright (c) 2006 Apple Computer, Inc. All rights reserved.

 This file contains Original Code and/or Modifications of Original Code
 as defined in and that are subject to the Apple Public Source License
 Version 2.0 (the 'License'). You may not use this file except in
 compliance with the License. Please obtain a copy of the License at
 http://www.opensource.apple.com/apsl/ and read it before using this
 file.

 The Original Code and all software distributed under the License are
 distributed on an 'AS IS' basis, WITHOUT WARRANTY OF ANY KIND, EITHER
 EXPRESS OR IMPLIED, AND APPLE HEREBY DISCLAIMS ALL SUCH WARRANTIES,
 INCLUDING WITHOUT LIMITATION, ANY WARRANTIES OF MERCHANTABILITY,
 FITNESS FOR A PARTICULAR PURPOSE, QUIET ENJOYMENT OR NON-INFRINGEMENT.
 Please see the License for the specific language governing rights and
 limitations under the License.

 DRI: Cyrus Daboo, cdaboo@apple.com
 -->

<caldavtest>
	<start/>
	
	<test-suite name='prop patches'>
		<test name='1'>
			<description>PROPPATCH of details: good</description>
			<request print-response='no'>
				<method>PROPPATCH</method>
				<data>
					<content-type>text/xml; charset=utf-8</content-type>
					<filepath>Resource/proppatches/1.xml</filepath>
				</data>
				<verify>
					<callback>propfindItems</callback>
					<arg>
						<name>okprops</name>
						<value>DAV:details</value>
					</arg>
				</verify>
			</request>
			<request print-response='no'>
				<method>PROPFIND</method>
				<header>
					<name>Depth</name>
					<value>0</value>
				</header>
				<data>
					<content-type>text/xml; charset=utf-8</content-type>
					<filepath>Resource/proppatches/2.xml</filepath>
				</data>
				<verify>
					<callback>propfindItems</callback>
					<arg>
						<name>okprops</name>
						<value>DAV:details$My Name</value>
					</arg>
				</verify>
			</request>
		</test>
		<test name='2'>
			<description>PROPPATCH of details: remove it</description>
			<request print-response='no'>
				<method>PROPPATCH</method>
				<data>
					<content-type>text/xml; charset=utf-8</content-type>
					<filepath>Resource/proppatches/3.xml</filepath>
				</data>
				<verify>
					<callback>propfindItems</callback>
					<arg>
						<name>okprops</name>
						<value>DAV:details</value>
					</arg>
				</verify>
			</request>
			<request print-response='no'>
				<method>PROPFIND</method>
				<header>
					<name>Depth</name>
					<value>0</value>
				</header>
				<data>
					<content-type>text/xml; charset=utf-8</content-type>
					<filepath>Resource/proppatches/2.xml</filepath>
				</data>
				<verify>
					<callback>propfindItems</callback>
					<arg>
						<name>badprops</name>
						<value>DAV:details</value>
					</arg>
				</verify>
			</request>
		</test>
		<test name='3'>
			<description>PROPPATCH remove non-existant</description>
			<request print-response='no'>
				<method>PROPPATCH</method>
				<data>
					<content-type>text/xml; charset=utf-8</content-type>
					<filepath>Resource/proppatches/4.xml</filepath>
				</data>
				<verify>
					<callback>propfindItems</callback>
					<arg>
						<name>badprops</name>
						<value>DAV:missing</value>
					</arg>
				</verify>
			</request>
		</test>
		<test name='4'>
			<description>PROPPATCH of resourcetype: fails</description>
			<request print-response='no'>
				<method>PROPPATCH</method>
				<data>
					<content-type>text/xml; charset=utf-8</content-type>
					<filepath>Resource/proppatches/5.xml</filepath>
				</data>
				<verify>
					<callback>propfindItems</callback>
					<arg>
						<name>badprops</name>
						<value>DAV:details</value>
						<value>DAV:resourcetype</value>
					</arg>
				</verify>
			</request>
		</test>
	</test-suite>
	
	<end/>
	
</caldavtest>
