<?xml version="1.0" standalone="no"?>

<!DOCTYPE caldavtest SYSTEM "caldavtest.dtd">

<!--
 Copyright (c) 2006 Apple Computer, Inc. All rights reserved.

 This file contains Original Code and/or Modifications of Original Code
 as defined in and that are subject to the Apple Public Source License
 Version 2.0 (the 'License'). You may not use this file except in
 compliance with the License. Please obtain a copy of the License at
 http://www.opensource.apple.com/apsl/ and read it before using this
 file.

 The Original Code and all software distributed under the License are
 distributed on an 'AS IS' basis, WITHOUT WARRANTY OF ANY KIND, EITHER
 EXPRESS OR IMPLIED, AND APPLE HEREBY DISCLAIMS ALL SUCH WARRANTIES,
 INCLUDING WITHOUT LIMITATION, ANY WARRANTIES OF MERCHANTABILITY,
 FITNESS FOR A PARTICULAR PURPOSE, QUIET ENJOYMENT OR NON-INFRINGEMENT.
 Please see the License for the specific language governing rights and
 limitations under the License.

 DRI: Cyrus Daboo, cdaboo@apple.com
 -->

<caldavtest>
	<description>Test attachments with CalDAV</description>

	<start/>
	
	<test-suite name='Inline'>
		<test name='1' ignore='no'>
			<description>VEVENT with image/jpeg</description>
			<request end-delete='yes'>
				<method>PUT</method>
				<ruri>1.ics</ruri>
				<data>
					<content-type>text/calendar; charset=utf-8</content-type>
					<filepath>Resource/attachments/1.ics</filepath>
				</data>
				<verify>
					<callback>statusCode</callback>
				</verify>
			</request>
			<request>
				<method>GET</method>
				<ruri>1.ics</ruri>
				<verify>
					<callback>dataString</callback>
					<arg>
						<name>contains</name>
						<value>ATTACH;FMTTYPE=image/jpeg;ENCODING=BASE64;VALUE=BINARY:</value>
					</arg>
					<arg>
						<name>contains</name>
						<value>RQAUUUUAFFFFAH//2Q==</value>
					</arg>
				</verify>
			</request>
		</test>
		<test name='2' ignore='no'>
			<description>VTODO with image/jpeg</description>
			<request end-delete='yes'>
				<method>PUT</method>
				<ruri>2.ics</ruri>
				<data>
					<content-type>text/calendar; charset=utf-8</content-type>
					<filepath>Resource/attachments/2.ics</filepath>
				</data>
				<verify>
					<callback>statusCode</callback>
				</verify>
			</request>
			<request>
				<method>GET</method>
				<ruri>2.ics</ruri>
				<verify>
					<callback>dataString</callback>
					<arg>
						<name>contains</name>
						<value>ATTACH;FMTTYPE=image/jpeg;ENCODING=BASE64;VALUE=BINARY:</value>
					</arg>
					<arg>
						<name>contains</name>
						<value>RQAUUUUAFFFFAH//2Q==</value>
					</arg>
				</verify>
			</request>
		</test>
	</test-suite>

	<test-suite name='External'>
		<test name='1' ignore='no'>
			<description>VEVENT with http://</description>
			<request end-delete='yes'>
				<method>PUT</method>
				<ruri>3.ics</ruri>
				<data>
					<content-type>text/calendar; charset=utf-8</content-type>
					<filepath>Resource/attachments/3.ics</filepath>
				</data>
				<verify>
					<callback>statusCode</callback>
				</verify>
			</request>
			<request>
				<method>GET</method>
				<ruri>3.ics</ruri>
				<verify>
					<callback>dataString</callback>
					<arg>
						<name>contains</name>
						<value>ATTACHMENT:http://www.example.com/test.jpg</value>
					</arg>
				</verify>
			</request>
		</test>
		<test name='2' ignore='no'>
			<description>VTODO with image/jpeg</description>
			<request end-delete='yes'>
				<method>PUT</method>
				<ruri>4.ics</ruri>
				<data>
					<content-type>text/calendar; charset=utf-8</content-type>
					<filepath>Resource/attachments/4.ics</filepath>
				</data>
				<verify>
					<callback>statusCode</callback>
				</verify>
			</request>
			<request>
				<method>GET</method>
				<ruri>4.ics</ruri>
				<verify>
					<callback>dataString</callback>
					<arg>
						<name>contains</name>
						<value>ATTACHMENT:http://www.example.com/test.jpg</value>
					</arg>
				</verify>
			</request>
		</test>
	</test-suite>

	<end/>
	
</caldavtest>
