<?xml version="1.0" standalone="no"?>

<!DOCTYPE caldavtest SYSTEM "caldavtest.dtd">

<!--
 Copyright (c) 2006 Apple Computer, Inc. All rights reserved.

 This file contains Original Code and/or Modifications of Original Code
 as defined in and that are subject to the Apple Public Source License
 Version 2.0 (the 'License'). You may not use this file except in
 compliance with the License. Please obtain a copy of the License at
 http://www.opensource.apple.com/apsl/ and read it before using this
 file.

 The Original Code and all software distributed under the License are
 distributed on an 'AS IS' basis, WITHOUT WARRANTY OF ANY KIND, EITHER
 EXPRESS OR IMPLIED, AND APPLE HEREBY DISCLAIMS ALL SUCH WARRANTIES,
 INCLUDING WITHOUT LIMITATION, ANY WARRANTIES OF MERCHANTABILITY,
 FITNESS FOR A PARTICULAR PURPOSE, QUIET ENJOYMENT OR NON-INFRINGEMENT.
 Please see the License for the specific language governing rights and
 limitations under the License.

 DRI: Cyrus Daboo, cdaboo@apple.com
 -->

<caldavtest>
	<description>Test PUT method in CalDAV with various recurrences to ensure
	proper behaviour of server indexing</description>

	<start/>
	
	<test-suite name='VEVENTs'>
		<test name='1' ignore='no'>
			<description>PUT non-recurring timed event</description>
			<request end-delete='yes'>
				<method>PUT</method>
				<ruri>1.ics</ruri>
				<data>
					<content-type>text/calendar; charset=utf-8</content-type>
					<filepath>Resource/recurrenceput/1.txt</filepath>
				</data>
				<verify>
					<callback>statusCode</callback>
				</verify>
			</request>
		</test>
		<test name='2' ignore='no'>
			<description>PUT non-recurring all day event</description>
			<request end-delete='yes'>
				<method>PUT</method>
				<ruri>2.ics</ruri>
				<data>
					<content-type>text/calendar; charset=utf-8</content-type>
					<filepath>Resource/recurrenceput/2.txt</filepath>
				</data>
				<verify>
					<callback>statusCode</callback>
				</verify>
			</request>
		</test>
		<test name='3' ignore='no'>
			<description>PUT recurring (no exceptions) timed event</description>
			<request end-delete='yes'>
				<method>PUT</method>
				<ruri>3.ics</ruri>
				<data>
					<content-type>text/calendar; charset=utf-8</content-type>
					<filepath>Resource/recurrenceput/3.txt</filepath>
				</data>
				<verify>
					<callback>statusCode</callback>
				</verify>
			</request>
		</test>
		<test name='4' ignore='no'>
			<description>PUT recurring (no exceptions) all day event</description>
			<request end-delete='yes'>
				<method>PUT</method>
				<ruri>4.ics</ruri>
				<data>
					<content-type>text/calendar; charset=utf-8</content-type>
					<filepath>Resource/recurrenceput/4.txt</filepath>
				</data>
				<verify>
					<callback>statusCode</callback>
				</verify>
			</request>
		</test>
		<test name='5' ignore='no'>
			<description>PUT recurring (with exceptions) timed event</description>
			<request end-delete='yes'>
				<method>PUT</method>
				<ruri>5.ics</ruri>
				<data>
					<content-type>text/calendar; charset=utf-8</content-type>
					<filepath>Resource/recurrenceput/5.txt</filepath>
				</data>
				<verify>
					<callback>statusCode</callback>
				</verify>
			</request>
		</test>
		<test name='6' ignore='no'>
			<description>PUT recurring (with exceptions) all day event</description>
			<request end-delete='yes'>
				<method>PUT</method>
				<ruri>6.ics</ruri>
				<data>
					<content-type>text/calendar; charset=utf-8</content-type>
					<filepath>Resource/recurrenceput/6.txt</filepath>
				</data>
				<verify>
					<callback>statusCode</callback>
				</verify>
			</request>
		</test>
		<test name='7' ignore='no'>
			<description>PUT recurring (with future exceptions) timed event</description>
			<request end-delete='yes'>
				<method>PUT</method>
				<ruri>7.ics</ruri>
				<data>
					<content-type>text/calendar; charset=utf-8</content-type>
					<filepath>Resource/recurrenceput/7.txt</filepath>
				</data>
				<verify>
					<callback>statusCode</callback>
				</verify>
			</request>
		</test>
		<test name='8' ignore='no'>
			<description>PUT recurring (with future exceptions) all day event</description>
			<request end-delete='yes'>
				<method>PUT</method>
				<ruri>8.ics</ruri>
				<data>
					<content-type>text/calendar; charset=utf-8</content-type>
					<filepath>Resource/recurrenceput/8.txt</filepath>
				</data>
				<verify>
					<callback>statusCode</callback>
				</verify>
			</request>
		</test>
	</test-suite>
	
	<test-suite name='VTODOs' ignore='no'>
		<test name='1' ignore='no'>
			<description>Plain VTODO with no date - recurring</description>
			<request end-delete='yes'>
				<method>PUT</method>
				<ruri>1todo.ics</ruri>
				<data>
					<content-type>text/calendar; charset=utf-8</content-type>
					<filepath>Resource/todo/5.txt</filepath>
				</data>
				<verify>
					<callback>statusCode</callback>
				</verify>
			</request>
		</test>
		<test name='2' ignore='no'>
			<description>Plain VTODO with all-day DUE only - recurring</description>
			<request end-delete='yes'>
				<method>PUT</method>
				<ruri>2todo.ics</ruri>
				<data>
					<content-type>text/calendar; charset=utf-8</content-type>
					<filepath>Resource/todo/6.txt</filepath>
				</data>
				<verify>
					<callback>statusCode</callback>
				</verify>
			</request>
		</test>
		<test name='3' ignore='no'>
			<description>Plain VTODO with all-day DTSTART/DURATION only - recurring</description>
			<request end-delete='yes'>
				<method>PUT</method>
				<ruri>3todo.ics</ruri>
				<data>
					<content-type>text/calendar; charset=utf-8</content-type>
					<filepath>Resource/todo/7.txt</filepath>
				</data>
				<verify>
					<callback>statusCode</callback>
				</verify>
			</request>
		</test>
		<test name='4' ignore='no'>
			<description>Plain VTODO with all-day DTSTART only - recurring</description>
			<request end-delete='yes'>
				<method>PUT</method>
				<ruri>3todo.ics</ruri>
				<data>
					<content-type>text/calendar; charset=utf-8</content-type>
					<filepath>Resource/todo/8.txt</filepath>
				</data>
				<verify>
					<callback>statusCode</callback>
				</verify>
			</request>
		</test>
		<test name='5' ignore='no'>
			<description>Plain VTODO with timed DUE only - recurring</description>
			<request end-delete='yes'>
				<method>PUT</method>
				<ruri>4todo.ics</ruri>
				<data>
					<content-type>text/calendar; charset=utf-8</content-type>
					<filepath>Resource/todo/9.txt</filepath>
				</data>
				<verify>
					<callback>statusCode</callback>
				</verify>
			</request>
		</test>
		<test name='6' ignore='no'>
			<description>Plain VTODO with timed DTSTART/DURATION only - recurring</description>
			<request end-delete='yes'>
				<method>PUT</method>
				<ruri>5todo.ics</ruri>
				<data>
					<content-type>text/calendar; charset=utf-8</content-type>
					<filepath>Resource/todo/10.txt</filepath>
				</data>
				<verify>
					<callback>statusCode</callback>
				</verify>
			</request>
		</test>
		<test name='7' ignore='no'>
			<description>Plain VTODO with timed DTSTART/DURATION only - recurring</description>
			<request end-delete='yes'>
				<method>PUT</method>
				<ruri>5todo.ics</ruri>
				<data>
					<content-type>text/calendar; charset=utf-8</content-type>
					<filepath>Resource/todo/11.txt</filepath>
				</data>
				<verify>
					<callback>statusCode</callback>
				</verify>
			</request>
		</test>
	</test-suite>

	<end/>
	
</caldavtest>
