<?xml version="1.0"?>

<!DOCTYPE caldavtest SYSTEM "caldavtest.dtd">

<!--
 Copyright (c) 2006-2007 Apple Inc. All rights reserved.

 Licensed under the Apache License, Version 2.0 (the "License");
 you may not use this file except in compliance with the License.
 You may obtain a copy of the License at

  http://www.apache.org/licenses/LICENSE-2.0

 Unless required by applicable law or agreed to in writing, software
 distributed under the License is distributed on an "AS IS" BASIS,
 WITHOUT WARRANTIES OR CONDITIONS OF ANY KIND, either express or implied.
 See the License for the specific language governing permissions and
 limitations under the License.
 -->

<caldavtest>
	<start>
		<request>
			<method>DELETEALL</method>
			<ruri>$pathprefix1:/outbox/</ruri>
		</request>
		<request>
			<method>DELETEALL</method>
			<ruri>$pathprefix1:/inbox/</ruri>
		</request>
		<request user="$userid2:" pswd="$pswd2:">
			<method>DELETEALL</method>
			<ruri>$pathprefix2:/outbox/</ruri>
		</request>
		<request user="$userid2:" pswd="$pswd2:">
			<method>DELETEALL</method>
			<ruri>$pathprefix2:/inbox/</ruri>
		</request>
		<request user="$userid3:" pswd="$pswd3:">
			<method>DELETEALL</method>
			<ruri>$pathprefix3:/outbox/</ruri>
		</request>
		<request user="$userid3:" pswd="$pswd3:">
			<method>DELETEALL</method>
			<ruri>$pathprefix3:/inbox/</ruri>
		</request>
	</start>
	
	
	<test-suite name='POST (invite)' ignore='no'>
		<test name='1' count='10' stats='yes' ignore='no'>
			<description>POST to Outbox of regular invite - small</description>
			<request>
				<method>POST</method>
				<header>
				<ruri>$pathprefix1:/outbox/</ruri>
				<data>
					<content-type>text/calendar; charset=utf-8</content-type>
					<filepath>Resource/performance/schedule/1.ics</filepath>
				</data>
				<verify>
					<callback>statusCode</callback>
				</verify>
				<verify>
					<callback>header</callback>
					<arg>
						<name>header</name>
						<value>Location$^$pathprefix1:/outbox/[^/]+\.ics$</value>
					</arg>
				</verify>
			</request>
		</test>
		<test name='2' count='10' stats='yes' ignore='no'>
			<description>POST to Outbox of regular invite - medium</description>
			<request>
				<method>POST</method>
				<ruri>$pathprefix1:/outbox/</ruri>
				<data>
					<content-type>text/calendar; charset=utf-8</content-type>
					<filepath>Resource/performance/schedule/2.ics</filepath>
				</data>
				<verify>
					<callback>statusCode</callback>
				</verify>
				<verify>
					<callback>header</callback>
					<arg>
						<name>header</name>
						<value>Location$^$pathprefix1:/outbox/[^/]+\.ics$</value>
					</arg>
				</verify>
			</request>
		</test>
		<test name='3' count='10' stats='yes' ignore='no'>
			<description>POST to Outbox of regular invite - large</description>
			<request>
				<method>POST</method>
				<ruri>$pathprefix1:/outbox/</ruri>
				<data>
					<content-type>text/calendar; charset=utf-8</content-type>
					<filepath>Resource/performance/schedule/3.ics</filepath>
				</data>
				<verify>
					<callback>statusCode</callback>
				</verify>
				<verify>
					<callback>header</callback>
					<arg>
						<name>header</name>
						<value>Location$^$pathprefix1:/outbox/[^/]+\.ics$</value>
					</arg>
				</verify>
			</request>
		</test>
	</test-suite>
	
	<end/>
	
</caldavtest>
