<?xml version="1.0" standalone="no"?>

<!DOCTYPE caldavtest SYSTEM "caldavtest.dtd">

<!--
 Copyright (c) 2006-2007 Apple Inc. All rights reserved.

 Licensed under the Apache License, Version 2.0 (the "License");
 you may not use this file except in compliance with the License.
 You may obtain a copy of the License at

  http://www.apache.org/licenses/LICENSE-2.0

 Unless required by applicable law or agreed to in writing, software
 distributed under the License is distributed on an "AS IS" BASIS,
 WITHOUT WARRANTIES OR CONDITIONS OF ANY KIND, either express or implied.
 See the License for the specific language governing permissions and
 limitations under the License.

 DRI: Cyrus Daboo, cdaboo@apple.com
 -->

<caldavtest>
	<description>Test timezone cache</description>

	<start/>
	
	<test-suite name='Timezone cache'>
		<test name='1'>
			<description>PUT event with truncated timezone in April</description>
			<request end-delete='yes'>
				<method>PUT</method>
				<ruri>1.ics</ruri>
				<data>
					<content-type>text/calendar; charset=utf-8</content-type>
					<filepath>Resource/timezones/1.ics</filepath>
				</data>
				<verify>
					<callback>statusCode</callback>
				</verify>
			</request>
		</test>
		<test name='2'>
			<description>query for free busy with time range</description>
			<request print-response='no'>
				<method>REPORT</method>
				<data>
					<content-type>text/xml; charset=utf-8</content-type>
					<filepath>Resource/timezones/2.xml</filepath>
				</data>
				<verify>
					<callback>freeBusy</callback>
					<arg>
						<name>busy</name>
						<value>20070401T143000Z/20070401T153000Z</value>
					</arg>
				</verify>
			</request>
		</test>
		<test name='3'>
			<description>PUT event with truncated timezone in December</description>
			<request end-delete='yes'>
				<method>PUT</method>
				<ruri>3.ics</ruri>
				<data>
					<content-type>text/calendar; charset=utf-8</content-type>
					<filepath>Resource/timezones/3.ics</filepath>
				</data>
				<verify>
					<callback>statusCode</callback>
				</verify>
			</request>
		</test>
		<test name='4'>
			<description>query for free busy with time range</description>
			<request print-response='no'>
				<method>REPORT</method>
				<data>
					<content-type>text/xml; charset=utf-8</content-type>
					<filepath>Resource/timezones/2.xml</filepath>
				</data>
				<verify>
					<callback>freeBusy</callback>
					<arg>
						<name>busy</name>
						<value>20070401T143000Z/20070401T153000Z</value>
						<value>20071210T153000Z/20071210T163000Z</value>
					</arg>
				</verify>
			</request>
		</test>
	</test-suite>
	
	<test-suite name='Timezone cache - aliases'>
		<test name='1'>
			<description>PUT event with truncated timezone in April</description>
			<request end-delete='yes'>
				<method>PUT</method>
				<ruri>4.ics</ruri>
				<data>
					<content-type>text/calendar; charset=utf-8</content-type>
					<filepath>Resource/timezones/4.ics</filepath>
				</data>
				<verify>
					<callback>statusCode</callback>
				</verify>
			</request>
		</test>
		<test name='2'>
			<description>query for free busy with time range</description>
			<request print-response='no'>
				<method>REPORT</method>
				<data>
					<content-type>text/xml; charset=utf-8</content-type>
					<filepath>Resource/timezones/2.xml</filepath>
				</data>
				<verify>
					<callback>freeBusy</callback>
					<arg>
						<name>busy</name>
						<value>20070401T143000Z/20070401T153000Z</value>
						<value>20071210T153000Z/20071210T163000Z</value>
						<value>20070402T150000Z/20070402T160000Z</value>
					</arg>
				</verify>
			</request>
		</test>
		<test name='3'>
			<description>PUT event with truncated timezone in December</description>
			<request end-delete='yes'>
				<method>PUT</method>
				<ruri>5.ics</ruri>
				<data>
					<content-type>text/calendar; charset=utf-8</content-type>
					<filepath>Resource/timezones/5.ics</filepath>
				</data>
				<verify>
					<callback>statusCode</callback>
				</verify>
			</request>
		</test>
		<test name='4'>
			<description>query for free busy with time range</description>
			<request print-response='no'>
				<method>REPORT</method>
				<data>
					<content-type>text/xml; charset=utf-8</content-type>
					<filepath>Resource/timezones/2.xml</filepath>
				</data>
				<verify>
					<callback>freeBusy</callback>
					<arg>
						<name>busy</name>
						<value>20070401T143000Z/20070401T153000Z</value>
						<value>20071210T153000Z/20071210T163000Z</value>
						<value>20070402T150000Z/20070402T160000Z</value>
						<value>20071211T140000Z/20071211T150000Z</value>
					</arg>
				</verify>
			</request>
		</test>
	</test-suite>
	
	<end/>
	
</caldavtest>
