<?xml version="1.0" standalone="no"?>

<!DOCTYPE caldavtest SYSTEM "caldavtest.dtd">

<!--
 Copyright (c) 2006-2007 Apple Inc. All rights reserved.

 Licensed under the Apache License, Version 2.0 (the "License");
 you may not use this file except in compliance with the License.
 You may obtain a copy of the License at

  http://www.apache.org/licenses/LICENSE-2.0

 Unless required by applicable law or agreed to in writing, software
 distributed under the License is distributed on an "AS IS" BASIS,
 WITHOUT WARRANTIES OR CONDITIONS OF ANY KIND, either express or implied.
 See the License for the specific language governing permissions and
 limitations under the License.

 DRI: Cyrus Daboo, cdaboo@apple.com
 -->

<caldavtest>
	<description>Test default calendar behavior in CalDAV</description>

	<start/>
	
	<test-suite name='Default Property' ignore='no'>
		<test name='1'>
			<description>Look for empty property on inbox</description>
			<request print-response="no">
				<method>PROPFIND</method>
				<header>
					<name>Depth</name>
					<value>0</value>
				</header>
				<ruri>$pathprefix:/$inbox:/</ruri>
				<data>
					<content-type>text/xml; charset=utf-8</content-type>
					<filepath>Resource/implicit/defaultcalendar/1.xml</filepath>
				</data>
				<verify>
					<callback>propfindItems</callback>
					<arg>
						<name>okprops</name>
						<value>urn:ietf:params:xml:ns:caldavschedule-default-calendar-URL$&lt;href xmlns="DAV:"&gt;$calendarpath1:&lt;/href&gt;</value>
					</arg>
				</verify>
			</request>
		</test>
	</test-suite>
	
	<test-suite name='Set empty Property' ignore='no'>
		<test name='1'>
			<description>Set property on Inbox</description>
			<request print-response='no'>
				<method>PROPPATCH</method>
				<ruri>$pathprefix:/$inbox:/</ruri>
				<data>
					<content-type>text/xml; charset=utf-8</content-type>
					<filepath>Resource/implicit/defaultcalendar/4.xml</filepath>
				</data>
				<verify>
					<callback>propfindItems</callback>
					<arg>
						<name>okprops</name>
						<value>urn:ietf:params:xml:ns:caldavschedule-default-calendar-URL</value>
					</arg>
				</verify>
			</request>
		</test>
		<test name='2'>
			<description>Verify property on inbox</description>
			<request print-response="no">
				<method>PROPFIND</method>
				<header>
					<name>Depth</name>
					<value>0</value>
				</header>
				<ruri>$pathprefix:/$inbox:/</ruri>
				<data>
					<content-type>text/xml; charset=utf-8</content-type>
					<filepath>Resource/implicit/defaultcalendar/1.xml</filepath>
				</data>
				<verify>
					<callback>propfindItems</callback>
					<arg>
						<name>okprops</name>
						<value>urn:ietf:params:xml:ns:caldavschedule-default-calendar-URL$</value>
					</arg>
				</verify>
			</request>
		</test>
	</test-suite>
	
	<test-suite name='Set valid Property' ignore='no'>
		<test name='1'>
			<description>Look for empty property on inbox</description>
			<request print-response="no">
				<method>PROPFIND</method>
				<header>
					<name>Depth</name>
					<value>0</value>
				</header>
				<ruri>$pathprefix:/$inbox:/</ruri>
				<data>
					<content-type>text/xml; charset=utf-8</content-type>
					<filepath>Resource/implicit/defaultcalendar/1.xml</filepath>
				</data>
				<verify>
					<callback>propfindItems</callback>
					<arg>
						<name>okprops</name>
						<value>urn:ietf:params:xml:ns:caldavschedule-default-calendar-URL$</value>
					</arg>
				</verify>
			</request>
		</test>
		<test name='2'>
			<description>Set property on Inbox</description>
			<request print-response='no'>
				<method>PROPPATCH</method>
				<ruri>$pathprefix:/$inbox:/</ruri>
				<data>
					<content-type>text/xml; charset=utf-8</content-type>
					<filepath>Resource/implicit/defaultcalendar/2.xml</filepath>
				</data>
				<verify>
					<callback>propfindItems</callback>
					<arg>
						<name>okprops</name>
						<value>urn:ietf:params:xml:ns:caldavschedule-default-calendar-URL</value>
					</arg>
				</verify>
			</request>
		</test>
		<test name='3'>
			<description>Verify property on inbox</description>
			<request print-response="no">
				<method>PROPFIND</method>
				<header>
					<name>Depth</name>
					<value>0</value>
				</header>
				<ruri>$pathprefix:/$inbox:/</ruri>
				<data>
					<content-type>text/xml; charset=utf-8</content-type>
					<filepath>Resource/implicit/defaultcalendar/1.xml</filepath>
				</data>
				<verify>
					<callback>propfindItems</callback>
					<arg>
						<name>okprops</name>
						<value>urn:ietf:params:xml:ns:caldavschedule-default-calendar-URL$&lt;href xmlns="DAV:"&gt;$calendarpath1:&lt;/href&gt;</value>
					</arg>
				</verify>
			</request>
		</test>
	</test-suite>
	
	<test-suite name='Set invalid Property' ignore='no'>
		<test name='1'>
			<description>Set property on Inbox</description>
			<request print-response='no'>
				<method>PROPPATCH</method>
				<ruri>$pathprefix:/$inbox:/</ruri>
				<data>
					<content-type>text/xml; charset=utf-8</content-type>
					<filepath>Resource/implicit/defaultcalendar/3.xml</filepath>
				</data>
				<verify>
					<callback>propfindItems</callback>
					<arg>
						<name>badprops</name>
						<value>urn:ietf:params:xml:ns:caldavschedule-default-calendar-URL</value>
					</arg>
				</verify>
			</request>
		</test>
		<test name='2'>
			<description>Verify property on inbox</description>
			<request print-response="no">
				<method>PROPFIND</method>
				<header>
					<name>Depth</name>
					<value>0</value>
				</header>
				<ruri>$pathprefix:/$inbox:/</ruri>
				<data>
					<content-type>text/xml; charset=utf-8</content-type>
					<filepath>Resource/implicit/defaultcalendar/1.xml</filepath>
				</data>
				<verify>
					<callback>propfindItems</callback>
					<arg>
						<name>okprops</name>
						<value>urn:ietf:params:xml:ns:caldavschedule-default-calendar-URL$&lt;href xmlns="DAV:"&gt;$calendarpath1:&lt;/href&gt;</value>
					</arg>
				</verify>
			</request>
		</test>
	</test-suite>
	
	<end/>
	
</caldavtest>
